### ISSUE TITLE
Mac OS X 10.8.2 compilation problem

### ISSUE THREAD

**Issue by kalimatas** [tony2001/pinba_engine#12]
Hi,

I'm trying to compile Pinba on my local machine, but with no success. What I've done by this time:

1. Installed `Google Protocol Buffers` from sources.
2. Installed `libevent` and `judy` with brew.

The `./configure` part went ok. 

```bash
$ ./configure \
--libdir=/usr/local/mysql/lib/plugin \
--with-protobuf=/usr/local \
--with-mysql=/usr/local/mysql \
--with-event=usr/local/Cellar/libevent/2.0.21 \
--with-judy=/usr/local/Cellar/judy/1.0.5
```

But when I try to `make` I got these errors:

```bash
$ make
Making all in src
make  all-am
/bin/sh ../libtool --preserve-dup-deps --tag=CXX   --mode=compile g++ -DHAVE_CONFIG_H -I. -I/usr/local/mysql-5.5.28-osx10.6-x86/sql -I/usr/local/mysql-5.5.28-osx10.6-x86/include -I/usr/local/mysql-5.5.28-osx10.6-x86/regex -I/usr/local/mysql-5.5.28-osx10.6-x86     -g -O2 -fno-exceptions -fno-rtti -I/usr/local/include -I/usr/local/Cellar/libevent/2.0.21/include -I/usr/local/Cellar/judy/1.0.5/include -DMYSQL_DYNAMIC_PLUGIN -DGOOGLE_PROTOBUF_NO_RTTI -DNDEBUG -DJUDYERROR_NOTEST -MT pinba-pb.lo -MD -MP -MF .deps/pinba-pb.Tpo -c -o pinba-pb.lo pinba-pb.cc
libtool: compile:  g++ -DHAVE_CONFIG_H -I. -I/usr/local/mysql-5.5.28-osx10.6-x86/sql -I/usr/local/mysql-5.5.28-osx10.6-x86/include -I/usr/local/mysql-5.5.28-osx10.6-x86/regex -I/usr/local/mysql-5.5.28-osx10.6-x86 -g -O2 -fno-exceptions -fno-rtti -I/usr/local/include -I/usr/local/Cellar/libevent/2.0.21/include -I/usr/local/Cellar/judy/1.0.5/include -DMYSQL_DYNAMIC_PLUGIN -DGOOGLE_PROTOBUF_NO_RTTI -DNDEBUG -DJUDYERROR_NOTEST -MT pinba-pb.lo -MD -MP -MF .deps/pinba-pb.Tpo -c pinba-pb.cc  -fno-common -DPIC -o .libs/pinba-pb.o
libtool: compile:  g++ -DHAVE_CONFIG_H -I. -I/usr/local/mysql-5.5.28-osx10.6-x86/sql -I/usr/local/mysql-5.5.28-osx10.6-x86/include -I/usr/local/mysql-5.5.28-osx10.6-x86/regex -I/usr/local/mysql-5.5.28-osx10.6-x86 -g -O2 -fno-exceptions -fno-rtti -I/usr/local/include -I/usr/local/Cellar/libevent/2.0.21/include -I/usr/local/Cellar/judy/1.0.5/include -DMYSQL_DYNAMIC_PLUGIN -DGOOGLE_PROTOBUF_NO_RTTI -DNDEBUG -DJUDYERROR_NOTEST -MT pinba-pb.lo -MD -MP -MF .deps/pinba-pb.Tpo -c pinba-pb.cc -o pinba-pb.o >/dev/null 2>&1
mv -f .deps/pinba-pb.Tpo .deps/pinba-pb.Plo
/bin/sh ../libtool --preserve-dup-deps --tag=CXX   --mode=compile g++ -DHAVE_CONFIG_H -I. -I/usr/local/mysql-5.5.28-osx10.6-x86/sql -I/usr/local/mysql-5.5.28-osx10.6-x86/include -I/usr/local/mysql-5.5.28-osx10.6-x86/regex -I/usr/local/mysql-5.5.28-osx10.6-x86     -g -O2 -fno-exceptions -fno-rtti -I/usr/local/include -I/usr/local/Cellar/libevent/2.0.21/include -I/usr/local/Cellar/judy/1.0.5/include -DMYSQL_DYNAMIC_PLUGIN -DGOOGLE_PROTOBUF_NO_RTTI -DNDEBUG -DJUDYERROR_NOTEST -MT ha_pinba.lo -MD -MP -MF .deps/ha_pinba.Tpo -c -o ha_pinba.lo ha_pinba.cc
libtool: compile:  g++ -DHAVE_CONFIG_H -I. -I/usr/local/mysql-5.5.28-osx10.6-x86/sql -I/usr/local/mysql-5.5.28-osx10.6-x86/include -I/usr/local/mysql-5.5.28-osx10.6-x86/regex -I/usr/local/mysql-5.5.28-osx10.6-x86 -g -O2 -fno-exceptions -fno-rtti -I/usr/local/include -I/usr/local/Cellar/libevent/2.0.21/include -I/usr/local/Cellar/judy/1.0.5/include -DMYSQL_DYNAMIC_PLUGIN -DGOOGLE_PROTOBUF_NO_RTTI -DNDEBUG -DJUDYERROR_NOTEST -MT ha_pinba.lo -MD -MP -MF .deps/ha_pinba.Tpo -c ha_pinba.cc  -fno-common -DPIC -o .libs/ha_pinba.o
ha_pinba.cc:36:24: error: sql/field.h: No such file or directory
ha_pinba.cc:37:26: error: sql/structs.h: No such file or directory
ha_pinba.cc:38:26: error: sql/handler.h: No such file or directory
In file included from ha_pinba.cc:46:
ha_pinba.h:62: error: 'THR_LOCK' does not name a type
ha_pinba.h:78: error: expected class-name before '{' token
ha_pinba.h:79: error: 'THR_LOCK_DATA' does not name a type
ha_pinba.h:119: error: 'TABLE_SHARE' has not been declared
ha_pinba.h:162: error: use of enum 'ha_rkey_function' without previous declaration
ha_pinba.h:174: error: 'TABLE' has not been declared
ha_pinba.h:174: error: 'HA_CREATE_INFO' has not been declared
ha_pinba.h:177: error: ISO C++ forbids declaration of 'THR_LOCK_DATA' with no type
ha_pinba.h:177: error: expected ';' before '*' token
ha_pinba.h: In member function 'ulonglong ha_pinba::table_flags() const':
ha_pinba.h:131: error: 'HA_NO_AUTO_INCREMENT' was not declared in this scope
ha_pinba.h:131: error: 'HA_BINLOG_ROW_CAPABLE' was not declared in this scope
ha_pinba.h:131: error: 'HA_NO_TRANSACTIONS' was not declared in this scope
ha_pinba.h:131: error: 'HA_STATS_RECORDS_IS_EXACT' was not declared in this scope
ha_pinba.h: In member function 'ulong ha_pinba::index_flags(uint, uint, bool) const':
ha_pinba.h:136: error: 'HA_READ_NEXT' was not declared in this scope
ha_pinba.h:136: error: 'HA_READ_PREV' was not declared in this scope
ha_pinba.h:136: error: 'HA_READ_ORDER' was not declared in this scope
ha_pinba.h:136: error: 'HA_ONLY_WHOLE_INDEX' was not declared in this scope
ha_pinba.h: In member function 'uint ha_pinba::max_supported_record_length() const':
ha_pinba.h:145: error: 'HA_MAX_REC_LENGTH' was not declared in this scope
ha_pinba.h: In member function 'uint8 ha_pinba::table_cache_type()':
ha_pinba.h:151: error: 'HA_CACHE_TBL_NOCACHE' was not declared in this scope
ha_pinba.cc: At global scope:
ha_pinba.cc:86: error: expected initializer before '*' token
ha_pinba.cc:89: error: 'HASH' does not name a type
ha_pinba.cc:94: error: 'pinba_get_table_type' declared as an 'inline' variable
ha_pinba.cc:94: error: 'TABLE' was not declared in this scope
ha_pinba.cc:94: error: 'table' was not declared in this scope
ha_pinba.cc:95: error: expected ',' or ';' before '{' token
make[2]: *** [ha_pinba.lo] Error 1
make[1]: *** [all] Error 2
make: *** [all-recursive] Error 1
```

Could you please help me? Should I provide any additional info?

**Comment by Aleks0305** [comment]
Hello! 
I try to compile plugin for  centos 6 mysql 5.6.
./configure --with-mysql=/root/mysql-src/mysql-5.6.24 --with-judy=/usr/local/bin/judy-1.0.5 --with-event=/usr/local/bin/libevent-2.0.22 --with-libdir=/usr/lib64/mysql/plugin/
and see:
checking for pthread_setaffinity_np in -lpthread... yes
checking if compiler supports -R... no
checking if compiler supports -Wl,-rpath,... yes
checking for MySQL source code... /root/mysql-src/mysql-5.6.24
checking for MySQL version >= 5.1... ok
checking libevent install prefix... /usr/local/bin/libevent-2.0.22
checking if libevent requires -lrt... configure: error: something went wrong - c                                                                                                                               annot link libevent, please report (attach you config.log)

What is wrong?

**Comment by tony2001** [comment]
Well, what's in your config.log ?

**Comment by Aleks0305** [comment]
configure:16818: gcc -o conftest -g -O2 -I/usr/local/bin/libevent-2.0.22/include  -Wl,-rpath,/usr/local/bin/libevent-2.0.22//usr/lib64/mysql/plugin/ -L/usr/local/bin/libevent-2.0.22//usr/lib64/mysql/plugin/ -levent -rt conftest.c  -lm -levent >&5
gcc: unrecognized option '-rt'
conftest.c: In function 'main':
conftest.c:37: warning: passing argument 1 of 'event_set' from incompatible pointer type
/usr/local/bin/libevent-2.0.22/include/event2/event_compat.h:174: note: expected 'struct event *' but argument is of type 'struct event **'
/usr/bin/ld: cannot find -levent
collect2: ld returned 1 exit status
configure:16822: $? = 1
configure: program exited with status 1

**Comment by tony2001** [comment]
>/usr/local/bin/libevent-2.0.22//usr/lib64/mysql/plugin/ -L/usr/local/bin/libevent-2.0.22//usr/lib64/mysql/plugin/
Uhm. Whatever you're doing here, it's wrong.
What was your configure line? 
Just upload the config.log somewhere and post the link here, it'll help a lot.

**Comment by Aleks0305** [comment]
config.log - http://prtsrc.jcat.ru/config.log
the command: ./configure --with-mysql=/root/mysql-src/mysql-5.6.24 --with-judy=/usr/local/bin/judy-1.0.5 --with-event=/usr/local/bin/libevent-2.0.22 --with-libdir=/usr/lib64/mysql/plugin

**Comment by Aleks0305** [comment]
I compiled plugin  with command:
/configure   --with-mysql=/root/mysql-src/mysql-5.6.24 --with-judy=/usr/local/bin/judy-1.0.5 --with-event=/usr/local/bin/libevent-2.0.22 --libdir=/usr/lib64/mysql/plugin

and installed it and create database:
mysql>  INSTALL PLUGIN pinba SONAME 'libpinba_engine.so';
Query OK, 0 rows affected (0.09 sec)

mysql> CREATE DATABASE pinba;
Query OK, 1 row affected (0.02 sec)

After that load the tables, but see:
mysql -u root -D pinba < default_tables.sql
ERROR 1031 (HY000) at line 3: Table storage engine for 'request' doesn't have this option

**Comment by Aleks0305** [comment]
in show plugins I see peenba:
 PINBA                      | ACTIVE   | STORAGE ENGINE     | libpinba_engine.so | GPL

**Comment by tony2001** [comment]
Did you build MySQL yourself or did you use some prebuilt packages?

**Comment by Aleks0305** [comment]
On the server is mysql 5.6 from the rpm package mysql-community-server-5.6.24-3.el6.x86_64

mysql for pinba was obtained as follows:
1) Downloaded mysql-5.6.24.tar.gz from dev.mysql.com
2) Unpacked it 
3) Run cmake . && cd include && make in the MySQL sources root dir.

**Comment by tony2001** [comment]
Unfortunately, it's not that easy.
You have to use exactly the same options used to build the MySQL server when configuring the sources, otherwise internal structs used in the extension turn out to be of different size and all kind of problems may result.
Most likely the options you need are in the .spec file in src.rpm, but YMMV.

**Comment by Aleks0305** [comment]
Thank you for your response. I installed pinba sucessfully. But the question. Why do I see in the table requests server_name unknown for all the records:
|  66 | m.jpub   |         1 | unknown     | /var/www/html/contextor/www/bitrix/php_interface/cron_events.php           |        0 |           9472 |     0.11 |   0.0929 |   0.0169 |          0 |      0 |            14000 | NULL   |        0 |      | 1432403281 |
This is normal? 
Additionally, I installed pinboard - there I can not choose the sites. Visible only unknown.
Thank you.

**Comment by Aleks0305** [comment]
Hello,Antony.
Can you tell me why the server_name gets the value unknown. May be we need some specific settings of the web server or php-scripts?
Thank you.

**Comment by tony2001** [comment]
server_name is taken from $_SERVER['SERVER_NAME'] by default.
Apparently, there's not domain when executing CLI scripts, so it's empty.
You can set it manually with pinba_server_name_set() .

**Comment by Aleks0305** [comment]
I connected the two servers to pinba, where 90 percent of the sites written in php. But I do not see any statistics
mysql> select * from report_by_server_name;
+-----------+-------------+----------------+------------------+------------------+----------------+------------------+------------------+----------------+------------------+------------------+---------------+-----------------+-----------------+-------------+------------------------+--------------------------+-----------------+-------------+
| req_count | req_per_sec | req_time_total | req_time_percent | req_time_per_sec | ru_utime_total | ru_utime_percent | ru_utime_per_sec | ru_stime_total | ru_stime_percent | ru_stime_per_sec | traffic_total | traffic_percent | traffic_per_sec | server_name | memory_footprint_total | memory_footprint_percent | req_time_median | index_value |
+-----------+-------------+----------------+------------------+------------------+----------------+------------------+------------------+----------------+------------------+------------------+---------------+-----------------+-----------------+-------------+------------------------+--------------------------+-----------------+-------------+
|       143 |         143 |        7473.13 |              100 |          7473.13 |         1176.8 |              100 |           1176.8 |       0.183475 |              100 |           26.237 |       3732.35 |             100 |         3732.35 | unknown     |                2520860 |                      100 |        0.128906 | unknown     |
+-----------+-------------+----------------+------------------+------------------+----------------+------------------+------------------+----------------+------------------+------------------+---------------+-----------------+-----------------+-------------+------------------------+--------------------------+-----------------+-------------+
1 row in set (0.00 sec)
It gets only the php-scripts running on the cron fall in the statistics, but the statistics are not visible on the script spent through a web server.
right?

**Comment by tony2001** [comment]
Did you enable pinba for those two sites? 
What can you see in their phpinfo() regarding pinba? 
Are you able to send any stats from CLI? 
Is there a firewall between them?

**Comment by Aleks0305** [comment]
Hello.
I enable pinba on two servers. On each of them a lot of Apache virtual hosts for websites written in php.
in phpinfo():
pinba

Pinba support => enabled
Extension version => 1.1.0-dev

Directive => Local Value => Master Value
pinba.auto_flush => 1 => 1
pinba.enabled => 1 => 1
pinba.server => 89.17.40.XXX:3300 => 89.17.40.XXX:3300
"Are you able to send any stats from CLI? " Sorry, I do not quite understand how to do it

Is there a firewall between them? - yes, but I see traffic.All the necessary rules added.
33720 4950K ACCEPT     udp  --  *      *       0.0.0.0/0            0.0.0.0/0           udp dpt:3300

**Comment by Aleks0305** [comment]
Hello,Antony.
Please tell me there were earlier precedents that can not see the statistics directly from sites, but visible  the statistics on the information that comes when the script run from cron deamon.

**Comment by tony2001** [comment]
No, it's clearly a network issue.
Check that the settings are correct and you're able to send the data from some other servers (not behind the firewall), then see if you're able to send the data from command line (CLI - command line interface) PHP on those two servers.

**Comment by Aleks0305** [comment]
On the server where I installed pinba(local lan) also has sites on php,  pinba receives data directly through localhost. Immediately there no network problems. And I also do not see according to the site any statistics, only from php-scripts from cron or cli.

**Comment by nesterwsx** [comment]
> On 27 мая 2015 г., at 12:32, Aleks0305 <notifications@github.com> wrote:
> 
> On the server where I installed pinba(local lan) also has sites on php, pinba receives data directly through localhost. Immediately there no network problems. And I also do not see according to the site any statistics, only from php-scripts from cron or cli.

It means that pinba isn't enabled for php-fpm in php.ini (php-fpm may use other php.ini file than php-cli).

--
Alex Nesterov

**Comment by Aleks0305** [comment]
Alex, 
we use apache and  php5_module on centos 6.
Global php.ini contains /etc/php.d; these are loaded by default
pinba.ini file is located in a php.d. 
[root@dev php.d]# cat /etc/php.d/pinba.ini
; Enable pinba extension module
extension=pinba.so
pinba.enabled=1
pinba.server=192.168.1.70:3300

where 192.168.1.70 - ip of pinba server.

IN php -i I see:
pinba

Pinba support => enabled
Extension version => 1.1.0-dev

Directive => Local Value => Master Value
pinba.auto_flush => 1 => 1
pinba.enabled => 1 => 1
pinba.server => 192.168.1.70:3300 => 192.168.1.70:3300

**Comment by tony2001** [comment]
Okay, let's sum it up: pinba is installed on a server with an external IP behind a firewall.
It does work inside the network, right? Didn't get that localhost part, because localhost usually means loop interface, not an actual _network_.
And UDP packets don't seem to get through using the external IP, right?

There are tons of things that might have gone wrong. I'd start with opening another port on this server and the firewall, but TCP this time, so that you could actually check if you're able to connect to it from the outside. If that doesn't work - it's firewall 100%.
I'd also check if the outgoing packages aren't blocked somewhere on the external server.

**Comment by Aleks0305** [comment]
1) server has internal ip 192.168.1.70. for the connection from the Internet is nat from external ip on gateway 89.17.40.XXX port udp 3300 to the internal IP 192.168.1.70 port udp 3300. I see traffic via tcpdump
[root@dev php.d]# tcpdump -nn -i eth0 port 3300
tcpdump: verbose output suppressed, use -v or -vv for full protocol decode
listening on eth0, link-type EN10MB (Ethernet), capture size 65535 bytes
12:59:01.525357 IP 83.222.4.xxx.40521 > 192.168.1.70.3300: UDP, length 116
12:59:01.538494 IP 83.222.4.xxx.57645 > 192.168.1.70.3300: UDP, length 125
12:59:01.622753 IP 83.222.4.xxx.60454 > 192.168.1.70.3300: UDP, length 116
12:59:01.624571 IP 83.222.4.xxx.56557 > 192.168.1.70.3300: UDP, length 116
12:59:01.656323 IP 83.222.4.xxx.44700 > 192.168.1.70.3300: UDP, length 116
12:59:01.683908 IP 83.222.4.xxxx.51854 > 192.168.1.70.3300: UDP, length 124
12:59:01.728700 IP 83.222.4.xxx.46422 > 192.168.1.70.3300: UDP, length 116
12:59:03.533378 IP 83.222.4.xxx.47480 > 192.168.1.70.3300: UDP, length 126

[root@dev php.d]# lsof -i -n -P | grep 3300
mysqld     7045  mysql   14u  IPv4 12460946      0t0  UDP 192.168.1.70:3300

**Comment by Aleks0305** [comment]
83.222.4.xxx - outside server with php pinba module
192.168.1.70 - dev server with pinba server adn php pinba module and sites written php

**Comment by nesterwsx** [comment]
iptables -L -n ?
+
iptables -L -n -t nat?

**Comment by Aleks0305** [comment]
From server 192.168.1.70:
ACCEPT     udp  --  0.0.0.0/0            0.0.0.0/0           udp dpt:3300
[root@dev php.d]# iptables -n -L  -v | grep 3300
47505 6974K ACCEPT     udp  --  *      *       0.0.0.0/0            0.0.0.0/0           udp dpt:3300

Gateway, which made the nat, unfortunately, is not available for me, but if there is wrong settings, I would not see the packets through tcpdump.

**Comment by tony2001** [comment]
What do you get with `netstat -nl | grep 3300` on pinba server?

**Comment by Aleks0305** [comment]
[root@dev php.d]# netstat -nl | grep 3300
udp        0      0 192.168.1.70:3300           0.0.0.0:*

**Comment by tony2001** [comment]
Let's reiterate: it does work when sending packets inside the network (not localhost), right? The problem is only with packages coming through the firewall?

**Comment by Aleks0305** [comment]
no,
the problem exists in inside network(without firewall) and when packets flow from  Internet  through a firewall and NAT. 
So I think the problem does not belong to the network.
If there were problems with the network, I would not have seen the statistics at all, and so I do not see the information on the php-script works through the web.
Can I write you io Russian, to explain in detail the problem. I'm afraid my knowledge English may lack.

**Comment by tony2001** [comment]
Let's go to the mailing list in that case:  pinba-engine-ru@googlegroups.com
This ticket has nothing to do with your problem, after all.

**Comment by Aleks0305** [comment]
ok. Posted in group.

**Comment by Aleks0305** [comment]
When there are post in the group? After moderation?
